{
  "name": "@rescript/belt",
  "sources": [
    {
      "dir": "src"
    }
  ],
  "package-specs": [
    {
      "module": "commonjs",
      "suffix": ".cjs",
      "in-source": false
    },
    {
      "module": "esmodule",
      "suffix": ".mjs",
      "in-source": false
    }
  ],
  "compiler-flags": [
    "-no-keep-locs",
    "-no-alias-deps",
    "-bs-no-version-header",
    "-bs-no-check-div-by-zero",
    "-bs-cross-module-opt",
    "-w -3+50",
    "-warn-error A"
  ]
}
