{
  "gentypeconfig": {
    "language": "typescript",
    "module": "esmodule",
    "importPath": "relative",
    "debug": { "all": false },
    "exportInterfaces": false
  },
  "name": "@tests/gentype-genimport-single",
  "sources": [
    { "dir": "src", "subdirs": true }
  ],
  "package-specs": {
    "module": "esmodule",
    "in-source": true
  },
  "suffix": ".res.js"
}

