{
  "reanalyze": {
    "analysis": ["dce"],
    "suppress": [],
    "unsuppress": [],
    "transitive": true
  },
  "name": "@tests/reanalyze-deadcode",
  "jsx": { "version": 4 },
  "dependencies": ["@rescript/belt", "@rescript/react"],
  "sources": [
    {
      "dir": "src",
      "subdirs": true
    }
  ],
  "package-specs": {
    "module": "esmodule",
    "in-source": false
  },
  "suffix": ".res.js",
  "warnings": {
    "number": "-a"
  }
}
