{
  "name": "dev-playground",
  "sources": [
    {
      "dir": "src",
      "subdirs": true
    }
  ],
  "package-specs": {
    "module": "esmodule",
    "in-source": true
  },
  "suffix": ".res.mjs",
  "dependencies": ["xote"],
  "jsx": {
    "version": 4,
    "module": "XoteJSX"
  },
  "experimental-features": {
    "LetUnwrap": true
  },
  "compiler-flags": ["-open Xote"],
  "warnings": {
    "error": "+8"
  }
}
