{
  "name": "rescript-commonjs-tests",
  "dependencies": ["@rescript/belt"],
  "sources": [
    {
      "dir": "src",
      "subdirs": true
    }
  ],
  "package-specs": {
    "module": "commonjs",
    "in-source": true,
    "suffix": ".js"
  },
  "compiler-flags": [
    "-w -3-6-26-27-29-30-32..40-44-45-52-60-9-106+104",
    "-warn-error A"
  ]
}
