{
  "gentypeconfig": {
    "module": "esmodule",
    "shims": {
      "JsxEvent": "JsxEvent",
      "Belt": "Belt",
      "RescriptPervasives": "RescriptPervasives"
    },
    "debug": {
      "all": false
    },
    "exportInterfaces": false
  },
  "name": "@tests/gentype-react-example",
  "compiler-flags": [],
  "jsx": { "version": 4 },
  "dependencies": ["@rescript/belt", "@rescript/react"],
  "sources": [
    {
      "dir": "src",
      "subdirs": true
    }
  ],
  "package-specs": {
    "module": "esmodule",
    "in-source": true
  },
  "suffix": ".res.js"
}
