{
  "name": "@tests/analysis",
  "reanalyze": {
    "analysis": ["dce"]
  },
  "sources": [
    {
      "dir": "src",
      "subdirs": true
    }
  ],
  "compiler-flags": ["-w -33-44-8-26-27-110"],
  "dependencies": ["@rescript/belt", "@rescript/react"],
  "jsx": { "version": 4 },
  "package-specs": [{ "module": "commonjs", "in-source": false }],
  "suffix": ".res.js",
  "editor": {
    "autocomplete": {
      "array": ["ArrayUtils"],
      "Fastify.t": ["FastifyExt"]
    }
  }
}
